{
  "$schema": "https://json-schema.org/draft/2020-12/schema",
  "$id": "https://numbersauto.local/schemas/activity_review.schema.json",
  "title": "Activity Review",
  "type": "object",
  "required": [
    "schema_version",
    "stage",
    "lesson_id",
    "status",
    "decision",
    "findings",
    "blocking_issues",
    "warnings"
  ],
  "properties": {
    "schema_version": {
      "type": "string"
    },
    "stage": {
      "type": "string",
      "const": "activity_review_agent"
    },
    "lesson_id": {
      "type": "string"
    },
    "status": {
      "type": "string",
      "enum": [
        "succeeded",
        "succeeded_with_warning",
        "blocked"
      ]
    },
    "decision": {
      "type": "string",
      "enum": [
        "pass",
        "pass_with_warning",
        "blocked"
      ]
    },
    "findings": {
      "type": "array",
      "items": {
        "type": "object",
        "required": [
          "severity",
          "message",
          "evidence_refs"
        ],
        "properties": {
          "severity": {
            "type": "string",
            "enum": [
              "info",
              "warning",
              "error"
            ]
          },
          "message": {
            "type": "string"
          },
          "evidence_refs": {
            "type": "array",
            "items": {
              "type": "string"
            }
          }
        },
        "additionalProperties": false
      }
    },
    "blocking_issues": {
      "type": "array",
      "items": {
        "type": "string"
      }
    },
    "warnings": {
      "type": "array",
      "items": {
        "type": "string"
      }
    }
  },
  "additionalProperties": false
}
